<?xml version="1.0"?>
<transfers
    xmlns="spryker:databuilder-01"
    xmlns:xsi="http://www.w3.org/2001/XMLSchema-instance"
    xsi:schemaLocation="spryker:databuilder-01 http://static.spryker.com/databuilder-01.xsd"
>

    <transfer name="CommentRequest">
        <property name="ownerId" dataBuilderRule="numberBetween(100, 9999)"/>
        <property name="ownerType" dataBuilderRule="unique()->word"/>
    </transfer>

    <transfer name="CommentFilter">
        <property name="ownerId" dataBuilderRule="numberBetween(100, 9999)"/>
        <property name="ownerType" dataBuilderRule="unique()->word"/>
    </transfer>

    <transfer name="Comment">
        <property name="message" dataBuilderRule="sentence(5)"/>
    </transfer>

    <transfer name="CommentTag">
        <property name="name" dataBuilderRule="unique()->word"/>
    </transfer>

</transfers>
