<?xml version="1.0"?>
<transfers
    xmlns="spryker:databuilder-01"
    xmlns:xsi="http://www.w3.org/2001/XMLSchema-instance"
    xsi:schemaLocation="spryker:databuilder-01 http://static.spryker.com/databuilder-01.xsd"
>

    <transfer name="Merchant">
        <property name="merchantProfile" type="MerchantProfile"/>
    </transfer>

    <transfer name="MerchantProfile">
        <property name="contactPersonRole" dataBuilderRule="lexify('??????????')"/>
        <property name="contactPersonTitle" dataBuilderRule="=Mr"/>
        <property name="contactPersonFirstName" dataBuilderRule="firstName()"/>
        <property name="contactPersonLastName" dataBuilderRule="lastName()"/>
        <property name="contactPersonPhone" dataBuilderRule="lexify('??????????')"/>
        <property name="logoUrl" dataBuilderRule="lexify('??????????')"/>
        <property name="publicEmail" dataBuilderRule="email()"/>
        <property name="publicPhone" dataBuilderRule="lexify('??????????')"/>
        <property name="descriptionGlossaryKey" dataBuilderRule="lexify('??????????')"/>
        <property name="bannerUrlGlossaryKey" dataBuilderRule="lexify('??????????')"/>
        <property name="deliveryTimeGlossaryKey" dataBuilderRule="lexify('??????????')"/>
        <property name="termsConditionsGlossaryKey" dataBuilderRule="lexify('??????????')"/>
        <property name="cancellationPolicyGlossaryKey" dataBuilderRule="lexify('??????????')"/>
        <property name="imprintGlossaryKey" dataBuilderRule="lexify('??????????')"/>
        <property name="dataPrivacyGlossaryKey" dataBuilderRule="lexify('??????????')"/>
        <property name="fkMerchant" dataBuilderRule="randomNumber(5)"/>
        <property name="addressCollection" type="MerchantProfileAddress[]"/>
        <property name="merchantProfileLocalizedGlossaryAttributes" type="MerchantProfileLocalizedGlossaryAttributes[]"/>
    </transfer>

    <transfer name="MerchantProfileAddress">
        <property name="fkCountry" dataBuilderRule="=60"/>
        <property name="address1" dataBuilderRule="lexify('??????????')"/>
        <property name="address2" dataBuilderRule="lexify('??????????')"/>
        <property name="address3" dataBuilderRule="lexify('??????????')"/>
        <property name="city" dataBuilderRule="lexify('??????????')"/>
        <property name="zipCode" dataBuilderRule="lexify('??????????')"/>
        <property name="fkMerchantProfile" dataBuilderRule="="/>
    </transfer>

    <transfer name="MerchantProfileLocalizedGlossaryAttributes">
        <property name="locale" type="Locale"/>
        <property name="merchantProfileGlossaryAttributeValues" type="MerchantProfileGlossaryAttributeValues"/>
    </transfer>

    <transfer name="MerchantProfileGlossaryAttributeValues">
        <property name="descriptionGlossaryKey" dataBuilderRule="lexify('??????????')"/>
        <property name="bannerUrlGlossaryKey" dataBuilderRule="lexify('??????????')"/>
        <property name="deliveryTimeGlossaryKey" dataBuilderRule="lexify('??????????')"/>
        <property name="termsConditionsGlossaryKey" dataBuilderRule="lexify('??????????')"/>
        <property name="cancellationPolicyGlossaryKey" dataBuilderRule="lexify('??????????')"/>
        <property name="imprintGlossaryKey" dataBuilderRule="lexify('??????????')"/>
        <property name="dataPrivacyGlossaryKey" dataBuilderRule="lexify('??????????')"/>
    </transfer>

    <transfer name="Url">
        <property name="fkLocale" type="int" dataBuilderRule="=66"/>
        <property name="url" type="string" dataBuilderRule="url()"/>
    </transfer>

</transfers>
